{
  "document_id": "FEMA-RAR#0046767 Max Meindl-Revised-20250526",
  "document_type": [
    "Other"
  ],
  "agency": [
    "FEMA"
  ],
  "case_number": "HS-FEMA-02430-2024",
  "created_date": "2025-05-26",
  "file_info": {
    "original_filename": "RAR#0046767 Max Meindl-Revised.pdf",
    "file_size": 2414676,
    "file_hash": "f4830e521f6b2287ec959d00daf78d822000350007e8562cca07744e4b2f448a",
    "mime_type": "application/pdf"
  },
  "processing_info": {
    "processed_date": "2025-05-26T20:49:18.174108",
    "validation_status": "Validated",
    "validation_errors": [
      "TEXT_EXTRACTION_FAILED"
    ]
  },
  "audit_trail": [
    {
      "timestamp": "2025-05-26T20:49:18.174108",
      "action": "Created",
      "user": "Max",
      "details": "Initial metadata creation"
    }
  ]
}