{
  "document_id": "FEMA-RESPONDENT REPLY(1)-20250526",
  "document_type": [
    "Other"
  ],
  "agency": [
    "FEMA"
  ],
  "case_number": "HS-FEMA-02430-2024",
  "created_date": "2025-05-26",
  "file_info": {
    "original_filename": "RESPONDENT REPLY(1).docx",
    "file_size": 25100,
    "file_hash": "ffd33bc768d893bf6a24b50cac2c95540b0eef6df50ca5e02efb02e8f023e40e",
    "mime_type": "application/vnd.openxmlformats-officedocument.wordprocessingml.document"
  },
  "processing_info": {
    "processed_date": "2025-05-26T20:49:23.067127",
    "validation_status": "Validated",
    "validation_errors": [
      "TEXT_EXTRACTION_FAILED"
    ]
  },
  "audit_trail": [
    {
      "timestamp": "2025-05-26T20:49:23.067127",
      "action": "Created",
      "user": "Max",
      "details": "Initial metadata creation"
    }
  ]
}