{
  "document_id": "FEMA-FW_ R6 RA Guidance Memo for SIs and PDMGs_6.30....-20250526",
  "document_type": [
    "Other"
  ],
  "agency": [
    "FEMA"
  ],
  "case_number": "HS-FEMA-02430-2024",
  "created_date": "2025-05-26",
  "file_info": {
    "original_filename": "FW_ R6 RA Guidance Memo for SIs and PDMGs_6.30.....pdf",
    "file_size": 333617,
    "file_hash": "f7ad0375d803e6ec963cfd56f07d1e378bec9b91ac5f9b805f5ce448178fc25b",
    "mime_type": "application/pdf"
  },
  "processing_info": {
    "processed_date": "2025-05-26T20:49:11.372746",
    "validation_status": "Validated",
    "validation_errors": [
      "TEXT_EXTRACTION_FAILED"
    ]
  },
  "audit_trail": [
    {
      "timestamp": "2025-05-26T20:49:11.372746",
      "action": "Created",
      "user": "Max",
      "details": "Initial metadata creation"
    }
  ]
}