{
  "document_id": "FEMA-RE_ Number RAR0042452(2)-20250526",
  "document_type": [
    "Other"
  ],
  "agency": [
    "FEMA"
  ],
  "case_number": "HS-FEMA-02430-2024",
  "created_date": "2025-05-26",
  "file_info": {
    "original_filename": "RE_ Number RAR0042452(2).pdf",
    "file_size": 238684,
    "file_hash": "071b3b5f1e8244c1ada8cfb3f93cf08ccf513def79cdb79c5b51735e9d3a1812",
    "mime_type": "application/pdf"
  },
  "processing_info": {
    "processed_date": "2025-05-26T20:49:20.034219",
    "validation_status": "Validated",
    "validation_errors": [
      "TEXT_EXTRACTION_FAILED"
    ]
  },
  "audit_trail": [
    {
      "timestamp": "2025-05-26T20:49:20.034219",
      "action": "Created",
      "user": "Max",
      "details": "Initial metadata creation"
    }
  ]
}