{
  "document_id": "EEOC-Table B-21   FY 2021   Complaint Closures with Benefits-20250526",
  "document_type": [
    "EEOC_Charge"
  ],
  "agency": [
    "EEOC"
  ],
  "case_number": "HS-FEMA-02430-2024",
  "created_date": "2025-05-26",
  "file_info": {
    "original_filename": "Table B-21   FY 2021   Complaint Closures with Benefits.xlsx",
    "file_size": 18208,
    "file_hash": "6c28e478986e8b23cca2ef0e4d782eef6cde85a967c5a49dcc35e0a3bbdd132b",
    "mime_type": "application/vnd.openxmlformats-officedocument.spreadsheetml.sheet"
  },
  "processing_info": {
    "processed_date": "2025-05-26T20:49:23.731782",
    "validation_status": "Validated",
    "validation_errors": []
  },
  "audit_trail": [
    {
      "timestamp": "2025-05-26T20:49:23.731782",
      "action": "Created",
      "user": "Max",
      "details": "Initial metadata creation"
    }
  ]
}