{
  "document_id": "FEMA-1430_1-20250526",
  "document_type": [
    "Other"
  ],
  "agency": [
    "FEMA"
  ],
  "case_number": "HS-FEMA-02430-2024",
  "created_date": "2025-05-26",
  "file_info": {
    "original_filename": "1430_1.pdf",
    "file_size": 70668,
    "file_hash": "771fb24460079a9bf5372485787e27a850aedf5fe87946baa78cba44604a58e4",
    "mime_type": "application/pdf"
  },
  "processing_info": {
    "processed_date": "2025-05-26T20:48:58.072579",
    "validation_status": "Validated",
    "validation_errors": [
      "TEXT_EXTRACTION_FAILED"
    ]
  },
  "audit_trail": [
    {
      "timestamp": "2025-05-26T20:48:58.072579",
      "action": "Created",
      "user": "Max",
      "details": "Initial metadata creation"
    }
  ]
}