{
  "document_id": "FEMA-RE_ Request to consider Reassignment - Reasonable Accommodation of Last Resort-meindl-08022024-20250526",
  "document_type": [
    "Interactive_Process"
  ],
  "agency": [
    "FEMA"
  ],
  "case_number": "HS-FEMA-02430-2024",
  "created_date": "2025-05-26",
  "file_info": {
    "original_filename": "RE_ Request to consider Reassignment - Reasonable Accommodation of Last Resort-meindl-08022024.pdf",
    "file_size": 361930,
    "file_hash": "60cd2aa7d4ded6d2a47faffa8fd9b02b39a55adb3dd948c550b561a98c3cfb10",
    "mime_type": "application/pdf"
  },
  "processing_info": {
    "processed_date": "2025-05-26T20:49:20.595058",
    "validation_status": "Validated",
    "validation_errors": [
      "TEXT_EXTRACTION_FAILED"
    ]
  },
  "audit_trail": [
    {
      "timestamp": "2025-05-26T20:49:20.595058",
      "action": "Created",
      "user": "Max",
      "details": "Initial metadata creation"
    }
  ]
}