{
  "document_id": "FEMA-New EEO Poster 2024-20250526",
  "document_type": [
    "Other"
  ],
  "agency": [
    "FEMA"
  ],
  "case_number": "HS-FEMA-02430-2024",
  "created_date": "2025-05-26",
  "file_info": {
    "original_filename": "New EEO Poster 2024.pdf",
    "file_size": 122012,
    "file_hash": "9365e5ac5c12a12cf95a81d5400092ff51701fc3fa41a63ab0023f792afec820",
    "mime_type": "application/pdf"
  },
  "processing_info": {
    "processed_date": "2025-05-26T20:49:13.711060",
    "validation_status": "Validated",
    "validation_errors": [
      "TEXT_EXTRACTION_FAILED"
    ]
  },
  "audit_trail": [
    {
      "timestamp": "2025-05-26T20:49:13.711060",
      "action": "Created",
      "user": "Max",
      "details": "Initial metadata creation"
    }
  ]
}