{
  "document_id": "OTHER-Revision 2 of scan.eml[1] (2)-20250526",
  "document_type": [
    "Email_Communication"
  ],
  "agency": [
    "OTHER"
  ],
  "case_number": "HS-FEMA-02430-2024",
  "created_date": "2025-05-26",
  "file_info": {
    "original_filename": "Revision 2 of scan.eml[1] (2).eml",
    "file_size": 192539,
    "file_hash": "576f157f4e0603f167f5a27e7a531c1283dbfb7bffa73fcc815cab8cd665ff94",
    "mime_type": "message/rfc822"
  },
  "processing_info": {
    "processed_date": "2025-05-26T20:49:31.261318",
    "validation_status": "Validated",
    "validation_errors": [
      "TEXT_EXTRACTION_FAILED"
    ]
  },
  "audit_trail": [
    {
      "timestamp": "2025-05-26T20:49:31.261318",
      "action": "Created",
      "user": "Max",
      "details": "Initial metadata creation"
    }
  ]
}