{
  "document_id": "FEMA-RAR0023025 has been assigned to you-20250526",
  "document_type": [
    "Other"
  ],
  "agency": [
    "FEMA"
  ],
  "case_number": "HS-FEMA-02430-2024",
  "created_date": "2025-05-26",
  "file_info": {
    "original_filename": "RAR0023025 has been assigned to you.pdf",
    "file_size": 178320,
    "file_hash": "0de27b4f7304bbdc91b545db6445499d22ed035257352ad4514da303056d810e",
    "mime_type": "application/pdf"
  },
  "processing_info": {
    "processed_date": "2025-05-26T20:49:18.559595",
    "validation_status": "Validated",
    "validation_errors": [
      "TEXT_EXTRACTION_FAILED"
    ]
  },
  "audit_trail": [
    {
      "timestamp": "2025-05-26T20:49:18.559595",
      "action": "Created",
      "user": "Max",
      "details": "Initial metadata creation"
    }
  ]
}