{
  "document_id": "OTHER-Update on your Employee Rights claim..eml[1] (2)-20250526",
  "document_type": [
    "Email_Communication"
  ],
  "agency": [
    "OTHER"
  ],
  "case_number": "HS-FEMA-02430-2024",
  "created_date": "2025-05-26",
  "file_info": {
    "original_filename": "Update on your Employee Rights claim..eml[1] (2).eml",
    "file_size": 14584,
    "file_hash": "403e243452fdfdec4d164d53cb24a2b77d224173279b9f275e4b9b2ba2034aec",
    "mime_type": "message/rfc822"
  },
  "processing_info": {
    "processed_date": "2025-05-26T20:49:31.742769",
    "validation_status": "Validated",
    "validation_errors": [
      "TEXT_EXTRACTION_FAILED"
    ]
  },
  "audit_trail": [
    {
      "timestamp": "2025-05-26T20:49:31.742769",
      "action": "Created",
      "user": "Max",
      "details": "Initial metadata creation"
    }
  ]
}