{
  "document_id": "FEMA-4611DR PA Draft ORG Chart 10.28.2022-20250526",
  "document_type": [
    "Other"
  ],
  "agency": [
    "FEMA"
  ],
  "case_number": "HS-FEMA-02430-2024",
  "created_date": "2025-05-26",
  "file_info": {
    "original_filename": "4611DR PA Draft ORG Chart 10.28.2022.pdf",
    "file_size": 363563,
    "file_hash": "4a5dbeefb8771e70c9347bda7ee714c61138f0cbd42dc64f225a46b996d3ceea",
    "mime_type": "application/pdf"
  },
  "processing_info": {
    "processed_date": "2025-05-26T20:48:58.579449",
    "validation_status": "Validated",
    "validation_errors": [
      "TEXT_EXTRACTION_FAILED"
    ]
  },
  "audit_trail": [
    {
      "timestamp": "2025-05-26T20:48:58.579449",
      "action": "Created",
      "user": "Max",
      "details": "Initial metadata creation"
    }
  ]
}