{
  "document_id": "OTHER-FMLA-v1-20250526",
  "document_type": [
    "Email_Communication"
  ],
  "agency": [
    "OTHER"
  ],
  "case_number": "HS-FEMA-02430-2024",
  "created_date": "2025-05-26",
  "file_info": {
    "original_filename": "FMLA-v1.eml",
    "file_size": 9521913,
    "file_hash": "f99e8179d29212712f0f3448c51a93437788d61bf458f981e024c47ba041a548",
    "mime_type": "message/rfc822"
  },
  "processing_info": {
    "processed_date": "2025-05-26T20:49:25.759544",
    "validation_status": "Validated",
    "validation_errors": [
      "TEXT_EXTRACTION_FAILED"
    ]
  },
  "audit_trail": [
    {
      "timestamp": "2025-05-26T20:49:25.759544",
      "action": "Created",
      "user": "Max",
      "details": "Initial metadata creation"
    }
  ]
}